{
  "schema": "factory/task@1",
  "id": "T-0025",
  "rev": 5,
  "created_at": "2026-10-11T16:30:00.000Z",
  "updated_at": "2026-10-12T12:10:00.000Z",
  "goal_id": "G-002",
  "epic_id": null,
  "kind": "spec",
  "title": "Spec: CSV export",
  "description": "Spec: CSV export. Follow the spec section for this work and keep the change small.",
  "role": "staff-engineer",
  "size": "M",
  "priority": "P2",
  "acceptance_criteria": [
    {
      "id": "AC-1",
      "text": "Spec: CSV export works as described in the spec"
    },
    {
      "id": "AC-2",
      "text": "Tests cover the happy path and one failure path"
    }
  ],
  "ac_version": 1,
  "files_owned": [],
  "files_shared": [],
  "files_read": [],
  "depends_on": [],
  "gate_deps": [],
  "gate": "G2",
  "risk_flags": [],
  "reviews_required": [],
  "reviews": {},
  "status": "ready",
  "status_reason": "Waiting: goal budget blocked",
  "attempts": 2,
  "max_attempts": 3,
  "rework_count": 0,
  "max_rework": 3,
  "fixups": 0,
  "estimate_tokens": 500000,
  "model_override": null,
  "branch": null,
  "base_ref": null,
  "current_run_id": null,
  "runs": [
    "R-000032",
    "R-000033"
  ],
  "blocked": null,
  "resume_from": null,
  "feedback": [],
  "answers": []
}
