{
  "schema": "factory/task@1",
  "id": "T-0006",
  "rev": 5,
  "created_at": "2026-10-11T14:00:00.000Z",
  "updated_at": "2026-10-11T14:30:00.000Z",
  "goal_id": "G-001",
  "epic_id": null,
  "kind": "sequence",
  "title": "Sequence: VIN decoder",
  "description": "Sequence: VIN decoder. Follow the spec section for this work and keep the change small.",
  "role": "project-manager",
  "size": "M",
  "priority": "P1",
  "acceptance_criteria": [
    {
      "id": "AC-1",
      "text": "Sequence: VIN decoder works as described in the spec"
    },
    {
      "id": "AC-2",
      "text": "Tests cover the happy path and one failure path"
    }
  ],
  "ac_version": 1,
  "files_owned": [],
  "files_shared": [],
  "files_read": [],
  "depends_on": [],
  "gate_deps": [],
  "gate": null,
  "risk_flags": [],
  "reviews_required": [],
  "reviews": {},
  "status": "done",
  "status_reason": null,
  "attempts": 1,
  "max_attempts": 3,
  "rework_count": 0,
  "max_rework": 3,
  "fixups": 0,
  "estimate_tokens": 150000,
  "model_override": null,
  "branch": null,
  "base_ref": null,
  "current_run_id": null,
  "runs": [
    "R-000006"
  ],
  "blocked": null,
  "resume_from": null,
  "feedback": [],
  "answers": []
}
