{
  "schema": "factory/task@1",
  "id": "T-0029",
  "rev": 11,
  "created_at": "2026-10-12T10:35:00.000Z",
  "updated_at": "2026-10-12T13:05:00.000Z",
  "goal_id": "G-003",
  "epic_id": null,
  "kind": "prd",
  "title": "PRD: audit log",
  "description": "PRD: audit log. Follow the spec section for this work and keep the change small.",
  "role": "product-manager",
  "size": "M",
  "priority": "P3",
  "acceptance_criteria": [
    {
      "id": "AC-1",
      "text": "PRD: audit log works as described in the spec"
    },
    {
      "id": "AC-2",
      "text": "Tests cover the happy path and one failure path"
    }
  ],
  "ac_version": 1,
  "files_owned": [],
  "files_shared": [],
  "files_read": [],
  "depends_on": [],
  "gate_deps": [],
  "gate": "G1",
  "risk_flags": [],
  "reviews_required": [],
  "reviews": {},
  "status": "awaiting_approval",
  "status_reason": null,
  "attempts": 1,
  "max_attempts": 3,
  "rework_count": 0,
  "max_rework": 3,
  "fixups": 0,
  "estimate_tokens": 300000,
  "model_override": null,
  "branch": null,
  "base_ref": null,
  "current_run_id": null,
  "runs": [
    "R-000035"
  ],
  "blocked": null,
  "resume_from": null,
  "feedback": [],
  "answers": []
}
