{
  "schema": "factory/task@1",
  "id": "T-0013",
  "rev": 12,
  "created_at": "2026-10-12T05:00:00.000Z",
  "updated_at": "2026-10-12T13:50:00.000Z",
  "goal_id": "G-001",
  "epic_id": "E-0002",
  "kind": "code",
  "title": "Decode endpoint response caching",
  "description": "Decode endpoint response caching. Follow the spec section for this work and keep the change small.",
  "role": "backend-engineer",
  "size": "M",
  "priority": "P1",
  "acceptance_criteria": [
    {
      "id": "AC-1",
      "text": "Decode endpoint response caching works as described in the spec"
    },
    {
      "id": "AC-2",
      "text": "Tests cover the happy path and one failure path"
    }
  ],
  "ac_version": 1,
  "files_owned": [
    "src/api/vin/cache/**"
  ],
  "files_shared": [],
  "files_read": [],
  "depends_on": [],
  "gate_deps": [],
  "gate": null,
  "risk_flags": [],
  "reviews_required": [
    [
      "code-reviewer"
    ]
  ],
  "reviews": {},
  "status": "in_review",
  "status_reason": null,
  "attempts": 1,
  "max_attempts": 3,
  "rework_count": 0,
  "max_rework": 3,
  "fixups": 0,
  "estimate_tokens": 600000,
  "model_override": null,
  "branch": "factory/T-0013-decode-endpoint-response-cachi",
  "base_ref": "factory/E-0002",
  "current_run_id": "R-000016",
  "runs": [
    "R-000015",
    "R-000016"
  ],
  "blocked": null,
  "resume_from": null,
  "feedback": [],
  "answers": []
}
