{
  "schema": "factory/task@1",
  "id": "T-0016",
  "rev": 8,
  "created_at": "2026-10-12T05:00:00.000Z",
  "updated_at": "2026-10-12T12:00:00.000Z",
  "goal_id": "G-001",
  "epic_id": "E-0002",
  "kind": "code",
  "title": "Error states for a bad VIN",
  "description": "Error states for a bad VIN. Follow the spec section for this work and keep the change small.",
  "role": "frontend-engineer",
  "size": "S",
  "priority": "P1",
  "acceptance_criteria": [
    {
      "id": "AC-1",
      "text": "Error states for a bad VIN works as described in the spec"
    },
    {
      "id": "AC-2",
      "text": "Tests cover the happy path and one failure path"
    }
  ],
  "ac_version": 1,
  "files_owned": [
    "web/src/app/intake/vin-errors/**"
  ],
  "files_shared": [],
  "files_read": [],
  "depends_on": [
    "T-0012"
  ],
  "gate_deps": [
    "G3"
  ],
  "gate": null,
  "risk_flags": [],
  "reviews_required": [
    [
      "code-reviewer"
    ],
    [
      "qa-engineer"
    ]
  ],
  "reviews": {},
  "status": "ready",
  "status_reason": null,
  "attempts": 0,
  "max_attempts": 3,
  "rework_count": 0,
  "max_rework": 3,
  "fixups": 0,
  "estimate_tokens": 250000,
  "model_override": null,
  "branch": "factory/T-0016-error-states-for-a-bad-vin",
  "base_ref": "factory/E-0002",
  "current_run_id": null,
  "runs": [],
  "blocked": null,
  "resume_from": null,
  "feedback": [],
  "answers": []
}
