{
  "schema": "factory/task@1",
  "id": "T-0012",
  "rev": 10,
  "created_at": "2026-10-12T05:00:00.000Z",
  "updated_at": "2026-10-12T14:10:00.000Z",
  "goal_id": "G-001",
  "epic_id": "E-0002",
  "kind": "code",
  "title": "Intake form VIN field with live decode",
  "description": "Intake form VIN field with live decode. Follow the spec section for this work and keep the change small.",
  "role": "frontend-engineer",
  "size": "M",
  "priority": "P1",
  "acceptance_criteria": [
    {
      "id": "AC-1",
      "text": "Intake form VIN field with live decode works as described in the spec"
    },
    {
      "id": "AC-2",
      "text": "Tests cover the happy path and one failure path"
    }
  ],
  "ac_version": 1,
  "files_owned": [
    "web/src/app/intake/vin-field/**"
  ],
  "files_shared": [],
  "files_read": [],
  "depends_on": [],
  "gate_deps": [
    "G3"
  ],
  "gate": null,
  "risk_flags": [],
  "reviews_required": [
    [
      "code-reviewer"
    ],
    [
      "qa-engineer"
    ]
  ],
  "reviews": {},
  "status": "in_progress",
  "status_reason": null,
  "attempts": 1,
  "max_attempts": 3,
  "rework_count": 0,
  "max_rework": 3,
  "fixups": 0,
  "estimate_tokens": 600000,
  "model_override": null,
  "branch": "factory/T-0012-intake-form-vin-field-with-liv",
  "base_ref": "factory/E-0002",
  "current_run_id": "R-000014",
  "runs": [
    "R-000014"
  ],
  "blocked": null,
  "resume_from": null,
  "feedback": [],
  "answers": []
}
