{
  "schema": "factory/task@1",
  "id": "T-0020",
  "rev": 9,
  "created_at": "2026-10-12T13:00:00.000Z",
  "updated_at": "2026-10-12T13:00:00.000Z",
  "goal_id": "G-001",
  "epic_id": "E-0002",
  "kind": "code",
  "title": "Barcode scanner input for VIN",
  "description": "Barcode scanner input for VIN. Follow the spec section for this work and keep the change small.",
  "role": "frontend-engineer",
  "size": "M",
  "priority": "P1",
  "acceptance_criteria": [
    {
      "id": "AC-1",
      "text": "Barcode scanner input for VIN works as described in the spec"
    },
    {
      "id": "AC-2",
      "text": "Tests cover the happy path and one failure path"
    }
  ],
  "ac_version": 1,
  "files_owned": [],
  "files_shared": [],
  "files_read": [],
  "depends_on": [],
  "gate_deps": [],
  "gate": null,
  "risk_flags": [],
  "reviews_required": [
    [
      "code-reviewer"
    ],
    [
      "qa-engineer"
    ]
  ],
  "reviews": {},
  "status": "draft",
  "status_reason": null,
  "attempts": 0,
  "max_attempts": 3,
  "rework_count": 0,
  "max_rework": 3,
  "fixups": 0,
  "estimate_tokens": 600000,
  "model_override": null,
  "branch": "factory/T-0020-barcode-scanner-input-for-vin",
  "base_ref": "factory/E-0002",
  "current_run_id": null,
  "runs": [],
  "blocked": null,
  "resume_from": null,
  "feedback": [],
  "answers": []
}
