{
  "schema": "factory/task@1",
  "id": "T-0018",
  "rev": 3,
  "created_at": "2026-10-12T05:00:00.000Z",
  "updated_at": "2026-10-12T10:00:00.000Z",
  "goal_id": "G-001",
  "epic_id": "E-0002",
  "kind": "code",
  "title": "Backfill decode cache for current stock",
  "description": "Backfill decode cache for current stock. Follow the spec section for this work and keep the change small.",
  "role": "data-engineer",
  "size": "M",
  "priority": "P1",
  "acceptance_criteria": [
    {
      "id": "AC-1",
      "text": "Backfill decode cache for current stock works as described in the spec"
    },
    {
      "id": "AC-2",
      "text": "Tests cover the happy path and one failure path"
    }
  ],
  "ac_version": 1,
  "files_owned": [
    "db/scripts/backfill-vin/**"
  ],
  "files_shared": [],
  "files_read": [],
  "depends_on": [],
  "gate_deps": [],
  "gate": null,
  "risk_flags": [],
  "reviews_required": [
    [
      "code-reviewer"
    ]
  ],
  "reviews": {},
  "status": "blocked",
  "status_reason": "Waiting for an answer: may we call the vendor API 4,000 times tonight?",
  "attempts": 1,
  "max_attempts": 3,
  "rework_count": 0,
  "max_rework": 3,
  "fixups": 0,
  "estimate_tokens": 600000,
  "model_override": null,
  "branch": "factory/T-0018-backfill-decode-cache-for-curr",
  "base_ref": "factory/E-0002",
  "current_run_id": null,
  "runs": [
    "R-000022"
  ],
  "blocked": {
    "reason": "open question",
    "question_id": "Q-1",
    "needs": "human",
    "since": "2026-10-12T10:00:00.000Z"
  },
  "resume_from": null,
  "feedback": [],
  "answers": []
}
