{
  "schema": "factory/task@1",
  "id": "T-0021",
  "rev": 10,
  "created_at": "2026-10-12T05:00:00.000Z",
  "updated_at": "2026-10-12T09:00:00.000Z",
  "goal_id": "G-001",
  "epic_id": "E-0002",
  "kind": "code",
  "title": "Retry vendor API on timeout",
  "description": "Retry vendor API on timeout. Follow the spec section for this work and keep the change small.",
  "role": "backend-engineer",
  "size": "M",
  "priority": "P1",
  "acceptance_criteria": [
    {
      "id": "AC-1",
      "text": "Retry vendor API on timeout works as described in the spec"
    },
    {
      "id": "AC-2",
      "text": "Tests cover the happy path and one failure path"
    }
  ],
  "ac_version": 1,
  "files_owned": [],
  "files_shared": [],
  "files_read": [],
  "depends_on": [],
  "gate_deps": [],
  "gate": null,
  "risk_flags": [],
  "reviews_required": [
    [
      "code-reviewer"
    ]
  ],
  "reviews": {},
  "status": "failed",
  "status_reason": "Failed 3 attempts: npm test times out on the vendor mock",
  "attempts": 3,
  "max_attempts": 3,
  "rework_count": 0,
  "max_rework": 3,
  "fixups": 0,
  "estimate_tokens": 600000,
  "model_override": null,
  "branch": "factory/T-0021-retry-vendor-api-on-timeout",
  "base_ref": "factory/E-0002",
  "current_run_id": null,
  "runs": [
    "R-000023",
    "R-000024",
    "R-000025"
  ],
  "blocked": null,
  "resume_from": null,
  "feedback": [],
  "answers": []
}
