{
  "schema": "factory/task@1",
  "id": "T-0003",
  "rev": 10,
  "created_at": "2026-10-11T10:30:00.000Z",
  "updated_at": "2026-10-11T12:00:00.000Z",
  "goal_id": "G-001",
  "epic_id": null,
  "kind": "spec",
  "title": "Spec: VIN decoder",
  "description": "Spec: VIN decoder. Follow the spec section for this work and keep the change small.",
  "role": "staff-engineer",
  "size": "M",
  "priority": "P1",
  "acceptance_criteria": [
    {
      "id": "AC-1",
      "text": "Spec: VIN decoder works as described in the spec"
    },
    {
      "id": "AC-2",
      "text": "Tests cover the happy path and one failure path"
    }
  ],
  "ac_version": 1,
  "files_owned": [],
  "files_shared": [],
  "files_read": [],
  "depends_on": [],
  "gate_deps": [],
  "gate": "G2",
  "risk_flags": [],
  "reviews_required": [],
  "reviews": {
    "critic": {
      "verdict": "pass",
      "run_id": "R-000004",
      "round": 1,
      "at": "2026-10-11T11:50:00.000Z"
    }
  },
  "status": "done",
  "status_reason": null,
  "attempts": 1,
  "max_attempts": 3,
  "rework_count": 0,
  "max_rework": 3,
  "fixups": 0,
  "estimate_tokens": 500000,
  "model_override": null,
  "branch": null,
  "base_ref": null,
  "current_run_id": null,
  "runs": [
    "R-000003"
  ],
  "blocked": null,
  "resume_from": null,
  "feedback": [],
  "answers": []
}
